{
  "schemaVersion": "draftforge.availability/v1",
  "generatedAt": "2026-08-27T23:50:00.000Z",
  "scanReceipt": {
    "completedAt": "2026-08-27T23:49:30.000Z",
    "feeds": [
      { "id": "authenticated_espn_player_news", "url": "https://fantasy.espn.com/football/players/news", "retrievedAt": "2026-08-27T23:49:00.000Z", "status": "ok" },
      { "id": "official_nfl_news", "url": "https://www.nfl.com/news/", "retrievedAt": "2026-08-27T23:49:00.000Z", "status": "ok" }
    ]
  },
  "records": [
    {
      "identity": {
        "normalizedName": "sharedname",
        "team": "LAC",
        "position": "WR"
      },
      "classification": "league_ineligibility",
      "reasonCode": "league_ineligibility",
      "eventAt": "2026-08-27T23:30:00.000Z",
      "retrievedAt": "2026-08-27T23:49:00.000Z",
      "evidence": [
        {
          "kind": "official_league",
          "url": "https://www.nfl.com/news/example-ineligibility",
          "domain": "www.nfl.com",
          "publishedAt": "2026-08-27T23:30:00.000Z",
          "supportsClassification": "league_ineligibility"
        }
      ]
    }
  ]
}
